{
  "$schema": "https://json-schema.org/draft/2020-12/schema",
  "type": "object",
  "properties": {
    "schema_version": {
      "$ref": "#/$defs/__schema0"
    },
    "document_kind": {
      "$ref": "#/$defs/__schema1"
    },
    "id": {
      "$ref": "#/$defs/__schema2"
    },
    "run_id": {
      "$ref": "#/$defs/__schema3"
    },
    "case": {
      "$ref": "#/$defs/__schema4"
    },
    "attempt": {
      "$ref": "#/$defs/__schema10"
    },
    "status": {
      "$ref": "#/$defs/__schema11"
    },
    "started_at": {
      "$ref": "#/$defs/__schema12"
    },
    "ended_at": {
      "$ref": "#/$defs/__schema14"
    },
    "duration_ms": {
      "$ref": "#/$defs/__schema15"
    },
    "output_recorded": {
      "$ref": "#/$defs/__schema16"
    },
    "output": {
      "$ref": "#/$defs/__schema17"
    },
    "provenance": {
      "$ref": "#/$defs/__schema18"
    },
    "evidence_completeness": {
      "$ref": "#/$defs/__schema20"
    },
    "attributes": {
      "$ref": "#/$defs/__schema7"
    },
    "failure": {
      "$ref": "#/$defs/__schema21"
    }
  },
  "required": [
    "schema_version",
    "document_kind",
    "id",
    "run_id",
    "case",
    "attempt",
    "status",
    "started_at",
    "ended_at",
    "duration_ms",
    "output_recorded",
    "output",
    "provenance",
    "evidence_completeness",
    "attributes",
    "failure"
  ],
  "additionalProperties": false,
  "$defs": {
    "__schema0": {
      "type": "string",
      "const": "kensa.protocol.v1"
    },
    "__schema1": {
      "type": "string",
      "const": "invocation"
    },
    "__schema2": {
      "type": "string",
      "pattern": "^inv_[0-9a-f]{8}-[0-9a-f]{4}-7[0-9a-f]{3}-[89ab][0-9a-f]{3}-[0-9a-f]{12}$"
    },
    "__schema3": {
      "type": "string",
      "pattern": "^run_[0-9a-f]{8}-[0-9a-f]{4}-7[0-9a-f]{3}-[89ab][0-9a-f]{3}-[0-9a-f]{12}$"
    },
    "__schema4": {
      "type": "object",
      "properties": {
        "id": {
          "type": "string"
        },
        "input": {
          "$ref": "#/$defs/__schema5"
        },
        "metadata": {
          "$ref": "#/$defs/__schema7"
        }
      },
      "required": [
        "id",
        "input",
        "metadata"
      ],
      "additionalProperties": false
    },
    "__schema5": {
      "$ref": "#/$defs/__schema6"
    },
    "__schema6": {
      "anyOf": [
        {
          "type": "string"
        },
        {
          "type": "number"
        },
        {
          "type": "boolean"
        },
        {
          "type": "null"
        },
        {
          "type": "array",
          "items": {
            "$ref": "#/$defs/__schema6"
          }
        },
        {
          "type": "object",
          "propertyNames": {
            "type": "string"
          },
          "additionalProperties": {
            "$ref": "#/$defs/__schema6"
          }
        }
      ]
    },
    "__schema7": {
      "type": "object",
      "propertyNames": {
        "$ref": "#/$defs/__schema8"
      },
      "additionalProperties": {
        "$ref": "#/$defs/__schema9"
      }
    },
    "__schema8": {
      "type": "string"
    },
    "__schema9": {
      "anyOf": [
        {
          "type": "string"
        },
        {
          "type": "number"
        },
        {
          "type": "boolean"
        },
        {
          "type": "null"
        },
        {
          "type": "array",
          "items": {
            "$ref": "#/$defs/__schema9"
          }
        },
        {
          "type": "object",
          "propertyNames": {
            "type": "string"
          },
          "additionalProperties": {
            "$ref": "#/$defs/__schema9"
          }
        }
      ]
    },
    "__schema10": {
      "type": "integer",
      "minimum": 1,
      "maximum": 4294967295
    },
    "__schema11": {
      "type": "string",
      "enum": [
        "pending",
        "running",
        "pass",
        "fail",
        "error",
        "cancelled",
        "skipped",
        "interrupted"
      ]
    },
    "__schema12": {
      "anyOf": [
        {
          "$ref": "#/$defs/__schema13"
        },
        {
          "type": "null"
        }
      ]
    },
    "__schema13": {
      "type": "string"
    },
    "__schema14": {
      "anyOf": [
        {
          "$ref": "#/$defs/__schema13"
        },
        {
          "type": "null"
        }
      ]
    },
    "__schema15": {
      "anyOf": [
        {
          "type": "integer",
          "minimum": 0,
          "maximum": 9007199254740991
        },
        {
          "type": "null"
        }
      ]
    },
    "__schema16": {
      "type": "boolean"
    },
    "__schema17": {
      "anyOf": [
        {
          "$ref": "#/$defs/__schema5"
        },
        {
          "type": "null"
        }
      ]
    },
    "__schema18": {
      "type": "object",
      "properties": {
        "producer": {
          "$ref": "#/$defs/__schema19"
        },
        "producer_version": {
          "$ref": "#/$defs/__schema19"
        },
        "adapter": {
          "anyOf": [
            {
              "$ref": "#/$defs/__schema19"
            },
            {
              "type": "null"
            }
          ]
        },
        "adapter_version": {
          "anyOf": [
            {
              "$ref": "#/$defs/__schema19"
            },
            {
              "type": "null"
            }
          ]
        },
        "runtime": {
          "$ref": "#/$defs/__schema19"
        },
        "runtime_version": {
          "$ref": "#/$defs/__schema19"
        },
        "revision": {
          "anyOf": [
            {
              "$ref": "#/$defs/__schema19"
            },
            {
              "type": "null"
            }
          ]
        },
        "environment": {
          "anyOf": [
            {
              "$ref": "#/$defs/__schema19"
            },
            {
              "type": "null"
            }
          ]
        },
        "effects": {
          "type": "string",
          "enum": [
            "none",
            "captured",
            "sandboxed",
            "live"
          ]
        }
      },
      "required": [
        "producer",
        "producer_version",
        "adapter",
        "adapter_version",
        "runtime",
        "runtime_version",
        "revision",
        "environment",
        "effects"
      ],
      "additionalProperties": false
    },
    "__schema19": {
      "type": "string"
    },
    "__schema20": {
      "type": "object",
      "properties": {
        "status": {
          "type": "string",
          "enum": [
            "complete",
            "pending",
            "partial",
            "unavailable"
          ]
        },
        "reason": {
          "anyOf": [
            {
              "$ref": "#/$defs/__schema19"
            },
            {
              "type": "null"
            }
          ]
        }
      },
      "required": [
        "status",
        "reason"
      ],
      "additionalProperties": false
    },
    "__schema21": {
      "anyOf": [
        {
          "type": "object",
          "properties": {
            "category": {
              "type": "string",
              "enum": [
                "agent",
                "simulator",
                "judge",
                "configuration",
                "infrastructure",
                "harness",
                "unknown"
              ]
            },
            "kind": {
              "$ref": "#/$defs/__schema19"
            },
            "message": {
              "$ref": "#/$defs/__schema19"
            },
            "evidence": {
              "$ref": "#/$defs/__schema7"
            }
          },
          "required": [
            "category",
            "kind",
            "message",
            "evidence"
          ],
          "additionalProperties": false
        },
        {
          "type": "null"
        }
      ]
    }
  }
}
