{
  "attempt": 1,
  "attributes": {},
  "case": {
    "id": "case-pending",
    "input": null,
    "metadata": {}
  },
  "document_kind": "invocation",
  "duration_ms": null,
  "ended_at": null,
  "evidence_completeness": {
    "reason": "Invocation has not started",
    "status": "pending"
  },
  "failure": null,
  "id": "inv_01890f47-6c20-7a81-b1c8-9e6f12d6406e",
  "output": null,
  "output_recorded": false,
  "provenance": {
    "adapter": null,
    "adapter_version": null,
    "effects": "none",
    "environment": null,
    "producer": "kensa",
    "producer_version": "0.1.0",
    "revision": null,
    "runtime": "rust",
    "runtime_version": "1.97.1"
  },
  "run_id": "run_01890f47-6c20-7a81-b1c8-9e6f12d6406e",
  "schema_version": "kensa.protocol.v1",
  "started_at": null,
  "status": "pending"
}
