{
  "attempt": 1,
  "attributes": {},
  "case": {
    "id": "case-1",
    "input": null,
    "metadata": {}
  },
  "document_kind": "invocation",
  "duration_ms": null,
  "ended_at": null,
  "evidence_completeness": {
    "reason": "skipped",
    "status": "unavailable"
  },
  "failure": {
    "category": "configuration",
    "evidence": {},
    "kind": "skipped",
    "message": "Invocation skipped"
  },
  "id": "inv_01890f47-6c20-7a81-b1c8-9e6f12d6406e",
  "output": null,
  "output_recorded": false,
  "provenance": {
    "adapter": null,
    "adapter_version": null,
    "effects": "none",
    "environment": null,
    "producer": "kensa",
    "producer_version": "1",
    "revision": null,
    "runtime": "node",
    "runtime_version": "24"
  },
  "run_id": "run_01890f47-6c20-7a81-b1c8-9e6f12d6406e",
  "schema_version": "kensa.protocol.v1",
  "started_at": null,
  "status": "skipped"
}
